{"diagnosticType":"read-only rendered DOM/computed-style evidence","templateId":"elementor_rendered_dom_computed_v1","templateVersion":"1.0.0","timestamp":"2026-07-01T00:00:00.000Z","url":"https://example.test/page","executionContext":"frontend","viewport":{"width":1440,"height":900,"devicePixelRatio":1},"limitation":"This reads rendered DOM/computed CSS only. It does not prove hidden Elementor panel values unless reflected in DOM/CSS or shown in a screenshot.","targets":[{"label":"feature card","selector":".smart-home__feature-card--default","matchCount":1,"matches":[{"index":0,"tag":"div","id":null,"classes":["smart-home__feature-card--default"],"attributes":{"class":"smart-home__feature-card--default"},"box":{"x":10,"y":20,"width":300,"height":120,"top":20,"right":310,"bottom":140,"left":10},"computed":{"display":"flex","padding-top":"16px","width":"300px","min-height":"120px","transform":"none","z-index":"auto","overflow":"visible"}}],"truncated":false}]}
